jiangId,degeId,tname,twName,cnName,enName,bo,wylie,sname,note,,,,,,,,,,,
J744b,816,འཕགས་པ་ཡངས་པའི་གྲོང་ཁྱེར་དུ་འཇུག་པའི་མདོ་ལས་འབྱུང་བའི་བདེ་ལེགས་ཀྱི་ཚིགས་སུ་བཅད་པ།,聖入毗舍離經中所出善妙偈,圣入毗舍离经中所出善妙偈,The Verses of Well-wishing in the Sūtra on Entering the City of Vaiśālī ,ཡངས་པའི་གྲོང་ཁྱེར་དུ་འཇུག་པའི་མདོ་བདེ་ལེགས་ཚིགས་སུ་བཅད་པ།,Ḥphags-pa yaṅs-paḥi groṅ-khyer-du ḥjug-paḥi mdo-las ḥbyuṅ-baḥi bde-legs-kyi tshigs-su-bcad-pa,,,,,,,,,,,,,
J745a,817,བདེ་ལེགས་ཀྱི་ཚིགས་སུ་བཅད་པ།,妙善樂偈,妙善乐偈,Verses of Well-wishing,བདེ་ལེགས་ཀྱི་ཚིགས་སུ་བཅད་པ,Bde-legs-kyi tshigs-su-bcad-pa,,,,,,,,,,,,,
J745b,818,བདེ་ལེགས་སུ་འགྱུར་བའི་ཚིགས་སུ་བཅད་པ།,成就善樂偈,成就善乐偈,Verses of Well-wishing,བདེ་ལེགས་སུ་འགྱུར་བའི་ཚིགས་སུ་བཅད་པ,Bde-legs-su ḥgyur-baḥi tshigs-su-bcad-pa,,,,,,,,,,,,,
J745c,819,ལྷས་ཞུས་པའི་བཀྲ་ཤིས་ཀྱི་ཚིགས་སུ་བཅད་པ།,天子請問吉祥偈,天子请问吉祥偈,The Verses of Auspicious by the God,ལྷས་ཞུས་པའི་བཀྲ་ཤིས་ཀྱི་ཚིགས་སུ་བཅད་པ,Lhas shus-paḥi bkra-śis-kyi tshigs-su-bcad-pa,Devaparipṛcchāmaṅgalagātha,,,,,,,,,,,,
J745d,820,དཔལ་རྣལ་འབྱོར་གྱི་རྒྱུད་ཀྱི་དཀྱིལ་འཁོར་གྱི་ལྷ་དེ་བཞིན་གཤེགས་པ་རིགས་ལྔ་འཁོར་དང་བཅས་པ།,吉祥瑜伽怛特羅曼荼羅諸尊如來五尊屬等三十七尊吉祥偈,吉祥瑜伽怛特罗曼荼罗诸尊如来五尊属等三十七尊吉祥偈,The Verses of Auspicious by the thirty seven Gods,དཔལ་རྣལ་འབྱོར་གྱི་རྒྱུད་ཀྱི་དཀྱིལ་འཁོར་གྱི་ལྷ་དེ་བཞིན་གཤེགས་པ་རིགས་ལྔ་འཁོར་དང་བཅས་པ་ལྷ་སུམ་ཅུ་རྩ་བདུན་གྱི་བཀྲ་ཤིས་ཚིགས་སུ་བཅད་པ,Dpal rnal-ḥbyor-gyi rgyud-kyi dkyil-ḥkhor-gyi lha de-bshin-gśegs-pa rigs lṅa ḥkhor daṅ-bcas-pa lha sum-cu-rtsa-bdun-gyi bkra-śis tshigs-su-bcad-pa,,,,,,,,,,,,,
J745e,821,སངས་རྒྱས་རབས་བདུན་གྱི་བཀྲ་ཤིས་ཀྱི་ཚིགས་སུ་བཅད་པ།,七佛吉祥偈,七佛吉祥偈,The Verses of Auspiciousness for the Seven Successive Past Buddhas,སངས་རྒྱས་རབས་བདུན་གྱི་བཀྲ་ཤིས་ཀྱི་ཚིགས་སུ་བཅད་པ,Saṅs-rgyas rabs bdun-gyi bkra-śis-kyi tshigs-su-bcad-pa,,,,,,,,,,,,,
J745f,822,དེ་བཞིན་གཤེགས་པ་ལྔའི་བཀྲ་ཤིས་ཚིགས་སུ་བཅད་པ།,五如來吉祥偈,五如来吉祥偈,Verses of Auspiciousness for the Five Tathāgatas,དེ་བཞིན་གཤེགས་པ་ལྔའི་བཀྲ་ཤིས་ཚིགས་སུ་བཅད་པ,De-bshin-gśegs-pa lṅaḥi bkra-śis tshigs-su bcad-pa,Pañcatathāgatamaṅgalagāthā,,,,,,,,,,,,
J745g,823,དཔལ་རིགས་གསུམ་གྱི་བཀྲ་ཤིས།,吉祥三尊吉祥（偈）,吉祥三尊吉祥（偈）,Auspiciousness for the Three Families,རིགས་གསུམ་གྱི་བཀྲ་ཤིས།,Dpal rigs gsum-gyi bkra-śis,,,,,,,,,,,,,
J745h,824,དཀོན་མཆོག་གསུམ་གྱི་བཀྲ་ཤིས་ཀྱི་ཚིགས་སུ་བཅད་པ།,三寶吉祥偈,三宝吉祥偈,Verses of Auspiciousness for the Three Jewels,དཀོན་མཆོག་གསུམ་གྱི་བཀྲ་ཤིས་ཀྱི་ཚིགས་སུ་བཅད་པ,Dkon-mchog gsum-gyi bkra-śis-kyi tshigs-su-bcad-pa,Ratnatrayamaṅgalagāthā,,,,,,,,,,,,
J745i,825,རིགས་གསུམ་གྱི་བཀྲ་ཤིས།,三尊吉祥（偈）,三尊吉祥（偈）,Auspiciousness for the Three Families,རིགས་གསུམ་གྱི་བཀྲ་ཤིས,Rigs gsum-gyi bkra-śis,,,,,,,,,,,,,
J745j,826,བཀྲ་ཤིས་ཀྱི་ཚིགས་སུ་བཅད་པ།,吉祥偈,吉祥偈,Verses of Auspiciousness,བཀྲ་ཤིས་ཀྱི་ཚིགས་སུ་བཅད་པ,Bkra-śis-kyi tshigs-su-bcad-pa,Maṅgalagāthā,,,,,,,,,,,,
J745k,827,དཀོན་མཆོག་གསུམ་གྱི་བཀྲ་ཤིས་ཀྱི་ཚིགས་སུ་བཅད་པ།,三寶吉祥偈,三宝吉祥偈,Verses of Auspiciousness of the Three Jewels,དཀོན་མཆོག་གསུམ་གྱི་བཀྲ་ཤིས་ཀྱི་ཚིགས་སུ་བཅད་པ,Dkon-mchog gsum-gyi bkra-śis-kyi tshigs-su-bcad-pa,Ratnatrayasvastigāthā,,,,,,,,,,,,
J746,828,ཆོས་ཐམས་ཅད་རྫོགས་པ་ཆེན་པོ་བྱང་ཆུབ་ཀྱི་སེམས་ཀུན་བྱེད་རྒྱལ་པོ།,一切法大圓滿菩提心普作王,一切法大圆满菩提心普作王,"The Sovereign, All-Creating Mind of Enlightenment",བྱང་སེམས་ཀུན་བྱེད་རྒྱལ་པོ།,byang sems kun byed rgyal po/,bodhicittakulayarāja,,,,,,,,,,,,
J747,829,དེ་བཞིན་གཤེགས་པ་ཐམས་ཅད་ཀྱི་ཐུགས་གསང་བའི་ཡེ་ཤེས་དོན་གྱི་སྙིང་པོ་རྡོ་རྗེ་བཀོད་པའི་རྒྱུད་རྣལ་འབྱོར་གྲུབ་པའི་ལུང་ཀུན་འདུས་རིག་པའི་མདོ་ཐེག་པ་ཆེན་པོ་མངོན་པར་རྟོགས་པ་ཆོས་ཀྱི་རྣམ་གྲངས་རྣམ་པར་བཀོད་པ་ཞེས་བྱ་བའི་མདོ།,一切如來心秘密智慧心髓義金剛莊嚴怛特羅瑜伽成就聖典總集明經大乘現觀法門莊嚴經,一切如来心秘密智慧心髓义金刚庄严怛特罗瑜伽成就圣典总集明经大乘现观法门庄严经,The Sūtra of All-Gathering Awareness (or The Sūtra that Gathers All Intentions),ཀུན་འདུས་རིག་པའི་མདོ། (མདོ་དགོངས་པ་འདུས་པ།),kun 'dus rig pa'i mdo/ \(mdo dgongs pa 'dus pa/\),samājasarvavidyāsūtra,,,,,,,,,,,,
J748,830,དེ་བཞིན་གཤེགས་པ་ཐམས་ཅད་ཀྱི་གསང་བ། གསང་བའི་མཛོད་ཆེན་པོ་མི་ཟད་པ་གཏེར་གྱི་སྒྲོན་མ། བརྟུལ་ཞུགས་ཆེན་པོ་བསྒྲུབ་པའི་རྒྱུད། ཡེ་ཤེས་རྔམ་པ་གློག་གི་འཁོར་ལོ་ཞེས་བྱ་བ་ཐེག་པ་ཆེན་པོའི་མདོ།,一切如來秘密大秘密藏無盡寶藏燈明大苦行成就怛特羅智慧希有電輪大乘經,一切如来秘密大秘密藏无尽宝藏灯明大苦行成就怛特罗智慧希有电轮大乘经,The Lightning Wheel of Magnificent Gnosis,ཡེ་ཤེས་རྔམ་པ་གློག་གི་འཁོར་ལོ།,ye shes rngam pa glog gi 'khor lo/,jñānāścaryadyuticakra,,,,,,,,,,,,
J749,831,དེ་བཞིན་གཤེགས་པ་ཐམས་ཅད་ཀྱི་ཐུགས་གསང་བའི་ཡེ་ཤེས་དོན་གྱི་སྙིང་པོ་ཁྲོ་བོ་རྡོ་རྗེའི་རིགས་ཀུན་འདུས་རིག་པའི་མདོ་རྣལ་འབྱོར་གྲུབ་པའི་རྒྱུད་ཅེས་བྱ་བ་ཐེག་པ་ཆེན་པོའི་མདོ།,一切如來心秘密智慧心髓義忿怒金剛眷屬總集明經瑜伽成就怛特羅大乘經,一切如来心秘密智慧心髓义忿怒金刚眷属总集明经瑜伽成就怛特罗大乘经,The Sūtra of All-Gathering Awareness,ཀུན་འདུས་རིག་པའི་མདོ།,kun 'dus rig pa'i mdo/,vajrakulatantra­piṇḍārtha­vidyāyogasiddha,,,,,,,,,,,,
J750,832,དཔལ་གསང་བའི་སྙིང་པོ་དེ་ཁོ་ན་ཉིད་རྣམ་པར་ངེས་པ།,吉祥秘密心髓真性決定,吉祥秘密心髓真性决定,The Secret Nucleus Definitive With Respect to the Real [the 22 chapter Guhyagarbha tantra],གསང་བའི་སྙིང་པོ་དེ་ཁོ་ན་ཉིད་རྣམ་པར་ངེས་པ།,gsang ba'i snying po de kho na nyid rnam par nges pa/,guhyagarbhatattvaviniścaya,,,,,,,,,,,,
J751,833,རྡོ་རྗེ་སེམས་དཔའི་སྒྱུ་འཕྲུལ་དྲ་བ་གསང་བ་ཐམས་ཅད་ཀྱི་མེ་ལོང་ཞེས་བྱ་བའི་རྒྱུད།,金剛薩埵幻網一切秘密鏡怛特羅,金刚萨埵幻网一切秘密镜怛特罗,"The Magical Net of Vajrasattva,  the Mirror of All Secrets",རྡོ་རྗེ་སེམས་དཔའི་སྒྱུ་འཕྲུལ་དྲ་བ་གསང་བ་ཐམས་ཅད་ཀྱི་མེ་ལོང།,rdo rje sems dpa'i sgyu 'phrul dra ba gsang ba thams cad kyi me long/,vajrasattva­māyājāla­guhyasarvādarśa,,,,,,,,,,,,
J752,834,གསང་བའི་སྙིང་པོ་དེ་ཁོ་ན་ཉིད་ངེས་པ།,秘密心髓真性決定,秘密心髓真性决定,The Secret Nucleus Definitive With Respect to the Real [the “80 chapter” Guhyagarbha tantra],གསང་བའི་སྙིང་པོ་དེ་ཁོ་ན་ཉིད་ངེས་པ།,gsang ba'i snying po de kho na nyid nges pa/,[no Sanskrit title],,,,,,,,,,,,
J753,835,འཕགས་པ་ཐབས་ཀྱི་ཞགས་པ་པད་མོའི་ཕྲེང་ཞེས་བྱ་བ།,聖方便索蓮華鬘,圣方便索莲华鬘,"The Noble Lasso of Methods,  the Lotus Garland",ཐབས་ཀྱི་ཞགས་པ་པདྨོའི་ཕྲེང་བ།,thabs kyi zhags pa pad+mo'i phreng ba/,[no Sanskrit title],,,,,,,,,,,,
J754,836,ལྷ་མོ་སྒྱུ་འཕྲུལ་དྲ་བ་ཆེན་མོ་ཞེས་བྱ་བའི་རྒྱུད།,天女大幻網怛特羅,天女大幻网怛特罗,The Tantra of the Great Magical Net of the Goddess,ལྷ་མོ་སྒྱུ་འཕྲུལ་དྲ་བ་ཆེན་པོའི་རྒྱུད།,lha mo sgyu 'phrul dra ba chen po'i rgyud/,devījālamahāmāyātantra,,,,,,,,,,,,
J755,837,གསང་བའི་སྙིང་པོ་དེ་ཁོ་ན་ཉིད་ངེས་པའི་བླ་མ་ཆེན་པོ།,秘密心髓真性決定大上師,秘密心髓真性决定大上师,The Great Guru,,གསང་བའི་སྙིང་པོ་དེ་ཁོ་ན་ཉིད་ངེས་པའི་བླ་མ་ཆེན་པོ།,gsang ba'i snying po de kho na nyid nges pa'i bla ma chen po/,Not Started,,,,,,,,,,,
J756,838,འཕགས་པ་འཇམ་དཔལ་ལས་བཞི་འཁོར་ལོ་གསང་བའི་རྒྱུད།,聖文殊師利四業輪秘密怛特羅,圣文殊师利四业轮秘密怛特罗,The Secret Tantra of the Wheel of Mañjuśrī's Four Activities,འཇམ་དཔལ་ལས་བཞི་འཁོར་ལོ་གསང་བའི་རྒྱུད།,'jam dpal las bzhi 'khor lo gsang ba'i rgyud/,mañjuśrīkarma­catuścakra­guhyatantra,,,,,,,,,,,,
J757,839,དེ་བཞིན་གཤེགས་པ་ཐམས་ཅད་ཀྱི་དགོངས་པ་བླ་ན་མེད་པ་གསང་བ་རྟ་མཆོག་རོལ་པའི་རྒྱུད་ཆེན་པོ་ཞེས་བྱ་བ།,一切如來無上密意秘密最上馬遊戲大怛特羅,一切如来无上密意秘密最上马游戏大怛特罗,The Great Tantra of Aśvottama's Display,རྟ་མཆོག་རོལ་པའི་རྒྱུད་ཆེན་པོ།,rta mchog rol pa'i rgyud chen po/,aśvottamavīṇāsamatāmahātantra,,,,,,,,,,,,
J758,840,དཔལ་ཧེ་རུ་ཀ་སྙིང་རྗེ་རོལ་པའི་རྒྱུད་གསང་བ་ཟབ་མོའི་མཆོག་ཅེས་བྱ་བ།,吉祥呬嚕迦慈悲遊戲怛特羅秘密甚深上,吉祥呬噜迦慈悲游戏怛特罗秘密甚深上,The Most Profound Secret Tantra of Śrī Heruka's Compassionate Display,དཔལ་ཧེ་རུ་ཀ་སྙིང་རྗེ་རོལ་པའི་རྒྱུད་གསང་བ་ཟབ་མོའི་མཆོག།,dpal he ru ka snying rje rol pa'i rgyud gsang ba zab mo'i mchog/,śrīheruka­karuṇakrīḍitatantra­guhyagambhīrottama,,,,,,,,,,,,
J759a,841a,ཐམས་ཅད་བདུད་རྩི་ལྔའི་རང་བཞིན། དངོས་གྲུབ་ཆེན་པོ་ཉེ་བའི་སྙིང་པོ་མཆོག,一切五甘露自性大效驗最上心髓八大卷,一切五甘露自性大效验最上心髓八大卷,"Eight Great Sections [starting with] The Quintessence of Great Accomplishment Whereby All Things Have the Nature of the Five Nectars--The Sap of the Five Amṛtas, Quintessence of Great Accomplishment",ཐམས་ཅད་བདུད་རྩེ་ལྔའི་རང་བཞིན། དངོས་གྲུབ་ཆེན་པོ་ཉེ་བའི་སྙིང་པོ་མཆོག་བམ་པོ་ཆེན་པོ་བརྒྱད་པ,Thams-cad bdud-rtse lṅaḥi raṅ-bshin dṅos-grub chen-po ñe-baḥi sñiṅ-po mchog bam-po chen-po brgyad-pa,Sarvapañcāmṛtasāra-siddhimahadgata-hṛdayaparivartāṣṭaka,thams cad bdud rtsi lnga'i rang bzhin dngos grub chen po nye ba'i snying po/,sarvapañcāmṛtasāra­siddhi­mahadgatahṛdaya, Summary & variant titles,Not Started,,,,,,,,
J759b,841b,ཚངས་པ་ལ་སོགས་པ་དྲང་སྲོང་དང། ལྷ་དང་ཀླུ་དང་མིའི་བྱང་ཆུབ་སེམས་དཔའ་རྣམས་ལ་ཕྱག་འཚལ་ལོ,禮拜梵等仙天龍菩薩人等,礼拜梵等仙天龙菩萨人等," Homage to Brahmā and Other Sages, Deities, Nāgas, and Human Bodhisattvas",ཚངས་པ་ལ་སོགས་པ་དྲང་སྲོང་དང། ལྷ་དང་ཀླུ་དང་མིའི་བྱང་ཆུབ་སེམས་དཔའ་རྣམས་ལ་ཕྱག་འཚལ་ལོ,Tshaṅ-pa la-sogs-pa draṅ-sroṅ daṅ lha daṅ klu daṅ miḥi byaṅ-chub-sems-dpaḥ rnams-la phyag-ḥtshal lo,Amṛtarasāyana, and Human Bodhisattvas,ཚངས་པ་ལ་སོགས་པ་དྲང་སྲོང་དང་ལྷ་དང་ཀླུ་དང་མིའི་བྱང་ཆུབ་སེམས་དཔའ་རྣམས་ལ་ཕྱག་འཚལ་ལོ།,tshangs pa la sogs pa drang srong dang lha dang klu dang mi'i byang chub sems dpa' rnams la phyag 'tshal lo/,amṛtarasāyana [Toh.], Summary & variant titles,Not Started,,,,,,
J759c,841c,བཅོམ་ལྡན་འདས་གཉིས་མེད་ཀྱི་རྒྱལ་པོ་ཆེན་པོ་ལ་ཕྱག་འཚལ་ལོ། དེ་ནས་སྤྱོད་པ་བསྟན་ཏེ། ལུང་ཨ་ནུ་ཡོ་ག་རྫོགས་པའི་རྣལ་འབྱོར་དུ་བསྟན་ཏེ།,禮拜薄伽梵無大王,礼拜薄伽梵无大王," Homage to the Blessed One, the Great King of Non-Duality",བཅོམ་ལྡན་འདས་གཉིས་མེད་ཀྱི་རྒྱལ་པོ་ཆེན་པོ་ལ་ཕག་འཚལ་ལོ,Bcom-ldan-ḥdas gñis med-kyi rgyal-po chen-po-la phyag-ḥtshal lo,Prajñābhagavanmahārāja,bcom ldan 'das gnyis med kyi rgyal po chen po la phyag 'tshal lo/,prajñābhagavānmahārāja, Summary & variant titles,Not Started,,,,,,,,
J759d,841d,འབྲས་བུ་ཆེན་པོ་ལྔ་བསྒྲལ་བའོ།། ཨ་ནུ་ཡོ་གའི་སྤྱོད་པ་བླ་ན་མེད་པ་བསྟན་པ།,五大果超越,五大果超越,Liberating the Five Great Fruits,འབྲས་བུ་ཆེན་པོ་ལྔ་བསྒྲལ་བ,Ḥbras-bu chen-po lṅa bsgral-ba,Uttāraṇamahādarapañca,uttāraṇamahādarapañca,Not Started,,,,,,,,,,
J759e,841e,རིགས་ལྔ་བདེ་བར་གཤེགས་པ་ལ་ཕྱག་འཚལ་ལོ། །མ་ཧཱ་ཡོ་གའི་དོན་དུ་སྒྲུབ་པའི་ཐབས་འདི་བསྟན་ཏོ། །,禮拜五種善逝,礼拜五种善逝,Homage to the Sugatas of the Five Families,རིགས་ལྔ་བདེ་བར་གཤེགས་པ་ལ་ཕྱག་འཚལ་ལོ,Rigs lṅa bde-bar-gśegs-pa-la phyag-ḥtshal lo,Kulapañcabuddhāya namaḥ,kulapañcabuddhaya namaḥ,Not Started,,,,,,,,,,
J759f,841f,བདུད་རྩི་འཁྱིལ་པ་ལ་ཕྱག་འཚལ་ལོ། བདུད་རྩི་སྦྱོར་བའི་ཐབས་བསྟན་པ།,禮拜甘露軍荼利,礼拜甘露军荼利,  Homage to Amṛtakuṇḍalī,བདུད་རྩི་འཁྱིལ་པ་ལ་ཕྱག་འཚལ་ལོ,Bdud-rtsi ḥkhyil-pa-la phyag-ḥtshal lo,Amṛtakuṇḍalyai namaḥ,amṛtakuṇḍalyai namaḥ,Not Started,,,,,,,,,,
J759g,841g,བདུད་རྩི་བུམ་པའི་ལུང་། བསྒྲུབ་པའི་ཡུལ་དང་གནས་བསྟན་པ།,甘露瓶取得,甘露瓶取得,Transmission of the Vase of Amṛta,བདུད་རྩི་བུམ་པའི་ལུང,Bdud-rtsi bum-paḥi luṅ,Amṛtakalaśasiddhi,amṛtakalaśasiddhi,Not Started,,,,,,,,,,
J759h,841h,བཅོམ་ལྡན་འདས་འཇམ་དཔལ་རྣོན་པོ་ལ་ཕྱག་འཚལ་ལོ།,禮拜薄伽梵文殊師利銳利,礼拜薄伽梵文殊师利锐利,Homage to the Blessed Mañjuśrī the Intelligent,བཅོམ་ལྡན་འདས་འཇམ་དཔལ་རྣོན་པོ་ལ་ཕྱག་འཚལ་ལོ,Bcom-ldan-ḥdas ḥjam-dpal rnon-po-la phyag-ḥtshal lo,Bhagavanmañjuśrītīkṣṇāya namaḥ,bhagavādmañjuśrītīkṣṇāya namaḥ,Not Started,,,,,,,,,,
J760,842,མཁའ་འགྲོ་མ་མེ་ལྕེ་འབར་བའི་རྒྱུད།,荼枳尼火焰光怛特羅,荼枳尼火焰光怛特罗,Tantra of the Flaming Ḍākinī,མཁའ་འགྲོ་མ་མེ་ལྕེ་འབར་བའི་རྒྱུད།,mkha' 'gro ma me lce 'bar ba'i rgyud/,ḍākinyagnijihvājvālātantra,,,,,,,,,,,,
J761,843,དྲག་སྔགས་འདུས་པ་རྡོ་རྗེ་རྩ་བའི་རྒྱུད་ཞེས་བྱ་བཿ,恐怖真言集金剛根本怛特羅,恐怖真言集金刚根本怛特罗,Root Tantra of Vajramantrabhīru,དྲག་སྔགས་འདུས་པ་རྡོ་རྗེ་རྩ་བའི་རྒྱུད།,drag sngags 'dus pa rdo rje rtsa ba'i rgyud/,vajramantrabhīrusandhimūlatantra,,,,,,,,,,,,
J762,844,འཇིག་རྟེན་མཆོད་བསྟོད་སྒྲུབ་པ་རྩ་བའི་རྒྱུད་ཞེས་བྱ་བ།,世間供養恭敬讚嘆成就根本怛特羅,世间供养恭敬赞叹成就根本怛特罗,The Tantra of Lokastotrapūja,འཇིག་རྟེན་མཆོད་བསྟོད་སྒྲུབ་པ་རྩ་བའི་རྒྱུད།,'jig rten mchod bstod sgrub pa rtsa ba'i rgyud/,lokastotrapūjakalpamūlatantra,,,,,,,,,,,,
J1006,845,བསྡུས་པའི་རྒྱུད་ཀྱི་རྒྱལ་པོ་དུས་ཀྱི་འཁོར་ལོའི་འགྲེལ་བཤད་རྩ་བའི་རྒྱུད་ཀྱི་རྗེས་སུ་འཇུག་པ་སྟོང་ཕྲག་བཅུ་གཉིས་པ་དྲི་མ་མེད་པའི་འོད་ཅེས་བྱ་བ།,略怛特羅王時輪經註釋根本怛特羅隨一萬二千無垢光,略怛特罗王时轮经注释根本怛特罗随一万二千无垢光,"The Kālacakra Commentary, 'Stainless Light'",བསྡུས་པའི་རྒྱུད་ཀྱི་རྒྱལ་པོ་དུས་ཀྱི་འཁོར་ལོའི་འགྲེལ་བཤད། རྩ་བའི་རྒྱུད་ཀྱི་རྗེས་སུ་འཇུག་པ་སྟོང་ཕྲག་བཅུ་གཉིས་པ་དྲི་མ་མེད་པའི་འོད་ཅེས་བྱ་བ,Bsdus-paḥi rgyud-kyi rgyal po dus-kyi ḥkhor-loḥi ḥgrel-bśad rtsa-baḥi rgyud-kyi rjes-su-ḥjug-pa stoṅ-phrag-bcu-gñis-pa dri-ma med-paḥi ḥod ces-bya-ba,Vimalaprabhā-nāma-mūlatantrānusāriṇīdvādaśasāhasrikā-laghukālacakra-tantra-rāja-ṭīkā,,,,,,,,,,,,
J764,846,སྤྱན་འདྲེན་རྒྱུད་གསུམ་པ།,勸請第三怛特羅,劝请第三怛特罗,The Three Part Invitation Tantra,སྤྱན་འདྲེན་རྒྱུད་གསུམ་པ,Spyan-ḥdren rgyud gsum-pa,,,,,,,,,,,,,
J765,847,འཕགས་པ་དཀོན་མཆོག་ཏ་ལ་ལའི་གཟུངས་ཞེས་བྱ་བ་ཐེག་པ་ཆེན་པོའི་མདོ,聖寶燈陀羅尼大乘經,圣宝灯陀罗尼大乘经,The Dhāraṇi of the Jewel Torch,དཀོན་མཆོག་ཏ་ལ་ལའི་གཟུངས།,dkon mchog ta la la'i gzungs/,ratnolkādhāraṇīsūtra,,,,,,,,,,,,
J766,848,འཕགས་པ་ཡེ་ཤེས་ཏ་ལ་ལ་ཞེས་བྱ་བའི་གཟུངས་འགྲོ་བ་ཐམས་ཅད་ཡོངས་སུ་སྦྱོང་བ།,聖智慧燈明陀羅尼一切趣清淨,圣智慧灯明陀罗尼一切趣清淨,The Dhāraṇi of the Torch of Gnosis,ཡེ་ཤེས་ཏ་ལ་ལའི་གཟུངས།,ye shes ta la la'i gzungs/,jñānolkadhāraṇī,,,,,,,,,,,,
J767,849,འཕགས་པ་ཚེ་དང་ཡེ་ཤེས་དཔག་ཏུ་མེད་པ་ཞེས་བྱ་བ་ཐེག་པ་ཆེན་པོའི་མདོ།,聖壽智無量大乘經,圣寿智无量大乘经,The Sūtra of Immeasurable Life and Gnosis,ཚེ་མདོ།,tshe mdo/,aparimitāyurjñānasūtra,,,,,,,,,,,,
J768,850,འཕགས་པ་ཚེ་དང་ཡེ་ཤེས་དཔག་ཏུ་མེད་པའི་སྙིང་པོ་ཞེས་བྱ་བའི་གཟུངས།,聖壽智無量心陀羅尼,圣寿智无量心陀罗尼,"The Incantation,  The Essence of Immeasurable Life and Gnosis",ཚེ་དང་ཡེ་ཤེས་དཔག་ཏུ་མེད་པའི་སྙིང་པོའི་གཟུངས།,tshe dang ye shes dpag tu med pa'i snying po'i gzungs/,aparimitāyurjñānahṛdayadhāraṇī,,,,,,,,,,,,
J769,851,འཕགས་པ་ཡོན་ཏན་བསྔགས་པ་དཔག་ཏུ་མེད་པ་ཞེས་བྱ་བའི་གཟུངས།,聖無量功德讚嘆陀羅尼,圣无量功德赞叹陀罗尼,"The Incantation,  Immeasurable Praise of Good Qualitie",ཡོན་ཏན་བསྔགས་པ་དཔག་ཏུ་མེད་པའི་གཟུངས།,yon tan bsngags pa dpag tu med pa'i gzungs/,aparimitaguṇānuśaṃsādhāraṇī,,,,,,,,,,,,
J770,852,འཕགས་པ་སངས་རྒྱས་བདུན་པ་ཞེས་བྱ་བ་ཐེག་པ་ཆེན་པོའི་མདོ།,聖七佛大乘經,圣七佛大乘经,The Sūtra of the Seven Buddhas,སངས་རྒྱས་བདུན་པའི་མདོ།,sangs rgyas bdun pa'i mdo/,saptabuddhakasūtra,,,,,,,,,,,,
J771,853,འཕགས་པ་སངས་རྒྱས་བཅུ་གཉིས་པ་ཞེས་བྱ་བ་ཐེག་པ་ཆེན་པོའི་མདོ།,聖十二佛大乘經,圣十二佛大乘经,The Sūtra of the Twelve Buddhas,སངས་རྒྱས་བཅུ་གཉིས་པའི་མདོ།,sangs rgyas bcu gnyis pa'i mdo/,dvādaśabuddhakasūtra,,,,,,,,,,,,
J772,854,འཕགས་པ་སངས་རྒྱས་ཀྱི་སྙིང་པོ་ཞེས་བྱ་བའི་གཟུངས་ཀྱི་ཆོས་ཀྱི་རྣམ་གྲངས།,聖佛心髓陀羅尼法門,圣佛心髓陀罗尼法门,"The Incantation,  the Essence of the Buddhas — a Dharma Discourse",སངས་རྒྱས་ཀྱི་སྙིང་པོའི་གཟུངས་ཀྱི་ཆོས་ཀྱི་རྣམ་གྲངས།,sangs rgyas kyi snying po'i gzungs kyi chos kyi rnam grangs/,buddhahṛdayadhāraṇīdharmaparyāya,,,,,,,,,,,,
