jiangId,degeId,tname,twName,cnName,enName,bo,wylie,sname,note,,,,,,,,,,,
J217,276,འཕགས་པ་སངས་རྒྱས་མི་སྤང་བ་ཞེས་བྱ་བ་ཐེག་པ་ཆེན་པོའི་མདོ།,聖不捨佛大乘經,圣不捨佛大乘经,The Sūtra on Not Rejecting the Buddha,སངས་རྒྱས་མི་སྤང་པའི་མདོ།,sangs rgyas mi spang pa'i mdo/,buddhākṣepaṇasūtra,,,,,,,,,,,,
J218,277,འཕགས་པ་དཀྱིལ་འཁོར་བརྒྱད་པ་ཞེས་བྱ་བ་ཐེག་པ་ཆེན་པོའི་མདོ།,聖八壇城大乘經,圣八坛城大乘经,The Sūtra of the Eight Maṇḍalas,དཀྱིལ་འཁོར་བརྒྱད་པའི་མདོ།,dkyil 'khor brgyad pa'i mdo/,aṣṭamaṇḍalakasūtra,,,,,,,,,,,,
J219,278,འཕགས་པ་བཀྲ་ཤིས་བརྒྱད་པ་ཞེས་བྱ་བ་ཐེག་པ་ཆེན་པོའི་མདོ།,聖八吉祥大乘經,圣八吉祥大乘经,The Sūtra on the Eightfold Auspiciousnesses,བཀྲ་ཤིས་བརྒྱད་པའི་མདོ།,bkra shis brgyad pa'i mdo/,maṅgalāṣṭakasūtra,,,,,,,,,,,,
J220,279,འཕགས་པ་སངས་རྒྱས་རྗེས་སུ་དྲན་པ།,聖隨念佛分,圣随念佛分,Being Mindful of the Buddha,སངས་རྒྱས་རྗེས་སུ་དྲན་པ།,sangs rgyas rjes su dran pa/,buddhānusmṛti,,,,,,,,,,,,
J221,280,ཆོས་རྗེས་སུ་དྲན་པ།,隨念法分,随念法分,Being Mindful of the Dharma,ཆོས་རྗེས་སུ་དྲན་པ།,chos rjes su dran pa/,dharmānusmṛti,,,,,,,,,,,,
J222,281,དགེ་འདུན་རྗེས་སུ་དྲན་པ།,隨念僧分,随念僧分,Being Mindful of the Community,དགེ་འདུན་རྗེས་སུ་དྲན་པ།,dge 'dun rjes su dran pa/,saṅghānusmṛti,,,,,,,,,,,,
J223,282,བསླབ་པ་གསུམ་གྱི་མདོ་ཞེས་བྱ་བ།,三學經,三学经,The Sūtra on the Threefold Training,བསླབ་པ་གསུམ་གྱི་མདོ།,bslab pa gsum gyi mdo/,śikṣātrayasūtra,,,,,,,,,,,,
J224,283,འཕགས་པ་སྐུ་གསུམ་ཞེས་བྱ་བ་ཐེག་པ་ཆེན་པོའི་མདོ།,聖三身大乘經,圣三身大乘经,The Sūtra of the Three Bodies,སྐུ་གསུམ་པའི་མདོ།,sku gsum pa'i mdo/,trikāyasūtra,,,,,,,,,,,,
J225,284,འཕགས་པ་ཕུང་པོ་གསུམ་པ་ཞེས་བྱ་བ་ཐེག་པ་ཆེན་པོའི་མདོ།,聖三蘊大乘經,圣三蕴大乘经,The Sūtra of the Three Heaps,ཕུང་པོ་གསུམ་པའི་མདོ།,phung po gsum pa'i mdo/,triskandhakasūtra,,,,,,,,,,,,
J226,285,འཕགས་པ་བསམ་པ་ཐམས་ཅད་ཡོངས་སུ་རྫོགས་པར་བྱེད་པ་ཞེས་བྱ་བའི་ཡོང་སུ་བསྔོ་བ།,聖滿一切願正迴向分,圣满一切愿正迴向分,The Dedication “Perfecting All Intentions”,བསམ་པ་ཡོངས་སུ་རྫོགས་པའི་ཡོངས་སུ་བསྔོ་བ།,bsam pa yongs su rdzogs pa'i yongs su bsngo ba/, Summary & variant titles,,,,,,,,,,,,
J227,286,འཕགས་པ་འགྲོ་བ་ཐམས་ཅད་ཡོངས་སུ་སྐྱོབ་པར་བྱེད་པ་ཞེས་བྱ་བའི་ཡོངས་སུ་བསྔོ་བ།,聖究竟救護一切有情正迴向分,圣究竟救护一切有情正迴向分,The Dedication “Protecting All Beings”,འགྲོ་བ་ཡོངས་སུ་སྐྱོབ་པར་བྱེད་པའི་ཡོངས་བསྔོ་བ།,'gro ba yongs su skyob par byed pa'i yongs bsngo ba/, Summary & variant titles,,,,,,,,,,,,
J228,287,འཕགས་པ་དམ་པའི་ཆོས་དྲན་པ་ཉེ་བར་གཞག་པ། ༼ཡ༽,聖正法念處經（一）,圣正法念处经（一）,Mindfulness of the True Dharma,དམ་ཆོས་དྲན་པ་ཉེར་བཞག,dam chos dran pa nyer bzhag,saddharmasmṛtyupasthāna,,,,,,,,,,,,
J229,288,མདོ་ཆེན་པོ་སྒྱུ་མའི་དྲ་བ་ཞེས་བྱ་བ།,幻網大經,幻网大经,The Great Sūtra of Illusion's Net,མདོ་ཆེན་སྒྱུ་མའི་དྲ་བ།,mdo chen sgyu ma'i dra ba/,māyājālasūtra,,,,,,,,,,,,
J230,289,མདོ་ཆེན་པོ་གཟུགས་ཅན་སྙིང་པོས་བསུ་བ་ཞེས་བྱ་བ།,具色寶藏所請大經,具色宝藏所请大经,The Great Sūtra of Bimbisāra’s Going Out to Meet [the Buddha],མདོ་ཆེན་པོ་གཟུགས་ཅན་སྙིང་པོས་བསུ་བ།,mdo chen po gzugs can snying pos bsu ba/,bimbisārapratyudgama­nanāmamahāsūtra,,,,,,,,,,,,
J231,290,མདོ་ཆེན་པོ་སྟོང་པ་ཉིད་ཅེས་བྱ་བ།,空性大經,空性大经,The Great Sūtra on Emptiness,མདོ་ཆེན་པོ་སྟོང་པ་ཉིད།,mdo chen po stong pa nyid/,śūnyatāmahāsutra,,,,,,,,,,,,
J232,291,མདོ་ཆེན་པོ་སྟོང་པ་ཉིད་ཆེན་པོ་ཞེས་བྱ་བ།,大空性大經,大空性大经,The Great Sūtra on Great Emptiness,མདོ་ཆེན་པོ་སྟོང་ཉིད་ཆེན་པོ།,mdo chen po stong nyid chen po/,mahāśūnyatāmahāsūtra,,,,,,,,,,,,
J233,292,མདོ་ཆེན་པོ་རྒྱལ་མཚན་མཆོག་ཅེས་བྱ་བ།,妙幢大經,妙幢大经,The Great Sūtra on the Best Banner,མདོ་ཆེན་པོ་རྒྱལ་མཚན་མཆོག,mdo chen po rgyal mtshan mchog,dhvajāgramahāsūtra,,,,,,,,,,,,
J234,293,མདོ་ཆེན་པོ་རྒྱལ་མཚན་དམ་པ་ཞེས་བྱ་བ།,正法幢大經,正法幢大经,The Great Sūtra on the Best Banner,མདོ་ཆེན་པོ་རྒྱལ་མཚན་དམ་པ།,mdo chen po rgyal mtshan dam pa/,dhvajāgramahāsūtra,,,,,,,,,,,,
J235,294,མདོ་ཆེན་པོ་ལྔ་གསུམ་པ་ཞེས་བྱ་བ།,五三大經,五三大经,The Great Sūtra on the Five and Three [Views],མདོ་ཆེན་པོ་ལྔ་གསུམ་པ།,mdo chen po lnga gsum pa/,pañcatrayasūtra,,,,,,,,,,,,
J236,295,འཕགས་པ་རྡོ་འཕངས་པའི་མདོ།,聖投石經,圣投石经,The Sūtra of Throwing Stones,རྡོ་འཕངས་པའི་མདོ།,rdo 'phangs pa'i mdo/,śilākṣiptasūtra,,,,,,,,,,,,
J237,296,གཞོན་ནུ་དཔེའི་མདོ།,孺童喻經,孺童喻经,The Sūtra on Examples of Youth,གཞོན་ནུའི་དཔེའི་མདོ།,gzhon nu'i dpe'i mdo/,kumāradṛṣṭāntasūtra,,,,,,,,,,,,
J238a,297,ཁམས་མང་པོ་པའི་མདོ།,多界經,多界经,The Sūtra of Many Domains,ཁམས་མང་པོའི་མདོ།,khams mang po'i mdo/,dhātubahukasūtra,,,,,,,,,,,,
J238b,298,གཎ་ཌཱིའི་མདོ།,犍地經,犍地经,Sūtra of the Gong,གཎྜཱིའི་མདོ།,gaN+DI'i mdo/,gaṇḍīsūtra,,,,,,,,,,,,
J239,299,གཎ་ཌཱིའི་དུས་ཀྱི་མདོ།,犍地時經,犍地时经,Sūtra on Times for the Gong,གཎྜཱིའི་དུས་ཀྱི་མདོ།,gaN+DI'i dus kyi mdo/,gaṇḍīsamayasūtra,,,,,,,,,,,,
J240,300,འཕགས་པ་དགེ་བའི་བཤེས་གཉེན་བསྟེན་པའི་མདོ།,聖依善知識經,圣依善知识经,The Sūtra on Reliance Upon a Virtuous Spiritual Friend,དགེ་བའི་བཤེས་གཉེན་བསྟེན་པའི་མདོ།,dge ba'i bshes gnyen bsten pa'i mdo/,kalyāṇamitrasevanasūtra,,,,,,,,,,,,
J241,301,མངོན་པར་འབྱུང་བའི་མདོ།,出家經,出家经,The Sūtra on Going Forth,མངོན་པར་འབྱུང་བའི་མདོ།,mngon par 'byung ba'i mdo/,abhiniṣkramaṇasūtra,,,,,,,,,,,,
J242,302,དགེ་སློང་ལ་རབ་ཏུ་གཅེས་པའི་མདོ་ཞེས་བྱ་བ།,珍愛比丘經,珍爱比丘经,The Sūtra of Cherishing Monks,དགེ་སློང་ལ་རབ་ཏུ་གཅེས་པའི་མདོ།,dge slong la rab tu gces pa'i mdo/,bhikṣupriyasūtra,,,,,,,,,,,,
J243,303,ཚུལ་ཁྲིམས་ཡང་དག་པར་ལྡན་པའི་མདོ།,真實具戒經,真实具戒经,The Sūtra on Correct Moral Discipline,ཚུལ་ཁྲིམས་ཡང་དག་ལྡན་པའི་མདོ།,tshul khrims yang dag ldan pa'i mdo/,śīlasaṃyuktasūtra,,,,,,,,,,,,
J244,304,ལྟུང་བ་སྡེ་ལྔའི་དགེ་བ་དང་མི་དགེ་བའི་འབྲས་བུ་བརྟག་པའི་མདོ།,觀察墮善惡果報經,观察堕善恶果报经,The Sūtra Examining the Virtuous and Non-Virtuous Effects of the Collection of Five Downfalls,ལྟུང་བ་སྡེ་ལྔའི་དགེ་བ་དང་མི་དགེ་བའི་འབྲས་བུ་བརྟག་པའི་མདོ།,ltung ba sde lnga'i dge ba dang mi dge ba'i 'bras bu brtag pa'i mdo/,pañcāpattinikāya­śubhāśubhaphalaparīkṣā­sūtra,,,,,,,,,,,,
J245,305,མཆོག་ཏུ་གདགས་པའི་མདོ།,最勝施設經,最胜施设经,Sūtra of the Highest Designation,མཆོག་ཏུ་གདགས་པའི་མདོ།,mchog tu gdags pa'i mdo/, Summary & variant titles,,,,,,,,,,,,
J246,306,རྣམ་པར་གྲོལ་བའི་ལམ་ལས་སྦྱངས་པའི་ཡོན་ཏན་བསྟན་པ་ཞེས་བྱ་བ།,解脫道中教誡頭陀功德分,解脱道中教诫头陀功德分,"Teaching the Qualities Purified,  from “The Path of Liberation”",རྣམ་གྲོལ་ལམ་ལས་སྦྱངས་པའི་ཡོན་ཏན་བསྟན་པ།,rnam grol lam las sbyangs pa'i yon tan bstan pa/,vimuktimārgadhutaguṇanirdeśa,Not Started,,,,,,,,,,,
J247,307,ཚེའི་མཐའི་མདོ།,壽際經,寿际经,Sūtra on the Limits of Life's Duration,ཚེའི་མཐའི་མདོ།,tshe'i mtha'i mdo/,āyuṣparyantasūtra,,,,,,,,,,,,
J248,308,ཚེ་འཕོ་བ་ཇི་ལྟར་འགྱུར་བ་ཞུས་པའི་མདོ།,請問死後云何流轉經,请问死后云何流转经,The Sūtra on Questions about How It Is to Die,ཚེ་འཕོ་བ་ཇི་ལྟར་འགྱུར་བ་ཞུས་པའི་མདོ།,tshe 'pho ba ji ltar 'gyur ba zhus pa'i mdo/,āyuṣpattiyathākāraparipṛcchāsūtra,,,,,,,,,,,,
J249,309,མི་རྟག་པ་ཉིད་ཀྱི་མདོ།,無常法性經,无常法性经,The Sūtra on Impermanence,མི་རྟག་པ་ཉིད་ཀྱི་མདོ།,mi rtag pa nyid kyi mdo/,anityatāsūtra,,,,,,,,,,,,
J250,310,མི་རྟག་པ་ཉིད་ཀྱི་མདོ།,無常法性經,无常法性经,The Sūtra on Impermanence,མི་རྟག་པ་ཉིད་ཀྱི་མདོ།,mi rtag pa nyid kyi mdo/,anityatāsūtra,,,,,,,,,,,,
J251,311,འཕགས་པ་འདུ་ཤེས་བཅུ་གཅིག་བསྟན་པའི་མདོ།,聖教授十一想蘊經,圣教授十一想蕴经,The Sūtra Teaching the Eleven Perceptions,འདུ་ཤེས་བཅུ་གཅིག་བསྟན་པའི་མདོ།,'du shes bcu gcig bstan pa'i mdo/,saṃjñānaikādaśanirdeśasūtra,,,,,,,,,,,,
J252,312,འཕགས་པ་ཡངས་པའི་གྲོང་ཁྱེར་དུ་འཇུག་པའི་མདོ་ཆེན་པོ།,聖入廣嚴城大經,圣入广严城大经,"The Mahāsūtra,  Entering the City of Vaiśālī",ཡངས་པའི་གྲོང་ཁྱེར་དུ་འཇུག་པའི་མདོ་ཆེན་པོ།,yangs pa'i grong khyer du 'jug pa'i mdo chen po/,vaiśālīpraveśamahāsūtra,,,,,,,,,,,,
J253,313,འཕགས་པ་མཚན་མོ་བཟང་པོ་ཞེས་བྱ་བའི་མདོ།,聖善夜經,圣善夜经,The Sūtra of the Good Night,མཚན་མོ་བཟང་པོའི་མདོ།,mtshan mo bzang po'i mdo/,bhadrakarātrīsūtra,,,,,,,,,,,,
J254,314,མུན་གྱི་ནགས་ཚལ་གྱི་སྒོ་ཞེས་བྱ་བའི་མདོ།,夜林門經,夜林门经,The Sūtra of the Entrance to the Gloomy Forest,མུན་གྱི་ནགས་ཚལ་གྱི་སྒོ་ཡི་མདོ།,mun gyi nags tshal gyi sgo yi mdo/,tamovanamukhasūtra,,,,,,,,,,,,
J255,315,ཕ་མའི་མདོ།,父母經,父母经,The Sūtra on One's Father and Mother,ཕ་མའི་མདོ།,pha ma'i mdo/,pitṛmātṛsūtra,,,,,,,,,,,,
J256,316,འཕགས་པ་བདེན་པ་བཞིའི་མདོ།,聖四諦經,圣四谛经,The Sūtra on the Four Truths,བདེན་པ་བཞིའི་མདོ།,bden pa bzhi'i mdo/,catuḥsatyasūtra,,,,,,,,,,,,
J257,317,དོན་རྣམ་པར་ངེས་པ་ཞེས་བྱ་བའི་ཆོས་ཀྱི་རྣམ་གྲངས།,決定要義法門,决定要义法门,The Dharma Discourse on the Ascertainment of the Meaning,དོན་རྣམ་པར་ངེས་པ་ཆོས་ཀྱི་རྣམ་གྲངས།,don rnam par nges pa chos kyi rnam grangs/,arthaviniścayadharmaparyāya,,,,,,,,,,,,
J258,318,འཕགས་པ་དོན་རྒྱས་པ་ཞེས་བྱ་བའི་ཆོས་ཀྱི་རྣམ་གྲངས།,聖圓滿諦法門,圣圆满谛法门,The Dharma Discourse on the Vast Meaning,དོན་རྒྱས་པའི་ཆོས་ཀྱི་རྣམ་གྲངས།,don rgyas pa'i chos kyi rnam grangs/,arthavistaradharmaparyāya,,,,,,,,,,,,
J259,319,འཕགས་པ་རྨད་དུ་བྱུང་བ་ཞེས་བྱ་བའི་ཆོས་ཀྱི་རྣམ་གྲངས།,聖希有法門分,圣希有法门分,The Marvelous Dharma Discourse,རྨད་དུ་བྱུང་བའི་ཆོས་ཀྱི་རྣམ་གྲངས།,rmad du byung ba'i chos kyi rnam grangs/,adbhūtadharmaparyāya,,,,,,,,,,,,
J260,320,འཕགས་པ་དེ་བཞིན་གཤེགས་པའི་གཟུགས་བརྙན་བཞག་པའི་ཕན་ཡོན་ཡང་དག་པར་བརྗོད་པ་ཞེས་བྱ་བའི་ཆོས་ཀྱི་རྣམ་གྲངས།,聖真實說造如來像功德法門,圣真实说造如来像功德法门,The Dharma Discourse Describing the Benefits of Establishing Representations of the Tathāgatha,དེ་བཞིན་གཤེགས་པའི་གཟུགས་བརྙན་བཞག་པའི་ཕན་ཡོན་བརྗོད་པའི་ཆོས་ཀྱི་རྣམ་གྲངས།,de bzhin gshegs pa'i gzugs brnyan bzhag pa'i phan yon brjod pa'i chos kyi rnam grangs/,tathāgatapratibimba­pratiṣṭhānuśaṃsasaṃvarṇana­dharmaparyāya,,,,,,,,,,,,
J261,321,མཆོད་རྟེན་བསྐོར་བའི་ཚིགས་སུ་བཅད་པ།,繞塔偈,绕塔偈,Verses on Circumambulating Reliquaries,མཆོད་རྟེན་བསྐོར་བའི་ཚིགས་བཅད།,mchod rten bskor ba'i tshigs bcad/,caityapradakṣiṇagāthā,,,,,,,,,,,,
J262,322,གསལ་རྒྱལ་གྱི་ཚིགས་སུ་བཅད་པ།,波斯匿（王）偈,波斯匿（王）偈,Verses on Prasenajit,གསལ་རྒྱལ་གྱི་ཚིགས་བཅད།,gsal rgyal gyi tshigs bcad/,prasenajidgāthā,,,,,,,,,,,,
J263,323,ཚིགས་སུ་བཅད་པ་གཅིག་པ།,一偈,一偈,The Single Stanza,ཚིགས་སུ་བཅད་པ་གཅིག་པ།,tshigs su bcad pa gcig pa/,ekagāthā,,,,,,,,,,,,
J264,324,ཚིགས་སུ་བཅད་པ་བཞི་པ།,四偈,四偈,The Four Stanzas,ཚིགས་སུ་བཅད་པ་བཞི་པ།,tshigs su bcad pa bzhi pa/,caturgāthā,,,,,,,,,,,,
J265,325,ཀླུའི་རྒྱལ་པོ་རྔ་སྒྲའི་ཚིགས་སུ་བཅད་པ།,龍王鼓音偈,龙王鼓音偈,Verses on the Nāga King Bherī,ཀླུའི་རྒྱལ་པོ་རྔ་སྒྲའི་ཚིགས་སུ་བཅད་པ།,klu'i rgyal po rnga sgra'i tshigs su bcad pa/,nāgarājabherīgāthā,,,,,,,,,,,,
J266,326,ཆེད་ཏུ་བརྗོད་པའི་ཚོམས།,出曜經,出曜经,Chapters of Utterances on Specific Topics,ཆེད་དུ་བརྗོད་པའི་ཚོམས།,ched du brjod pa'i tshoms/,udānavarga,,,,,,,,,,,,
J267,327,འཕགས་པ་སྐྱེས་བུ་དམ་པའི་མདོ།,聖真實丈夫經,圣真实丈夫经,Sūtra of the True Person,སྐྱེས་བུ་དམ་པའི་མདོ།,skyes bu dam pa'i mdo/,satpuruṣasūtra,,,,,,,,,,,,
J268,328,དགའ་བོ་རབ་ཏུ་བྱུང་བའི་མདོ།,難陀出家經,难陀出家经,The Sūtra of Nanda's Ordination,དགའ་བོ་རབ་ཏུ་བྱུང་བའི་མདོ།,dga' bo rab tu byung ba'i mdo/,nandapravrajyāsūtra,,,,,,,,,,,,
J269,329,ལྷའི་མདོ།,天經,天经,The Sūtra of the God,ལྷའི་མདོ།,lha'i mdo/,devatāsūtra,,,,,,,,,,,,
J270,330,ལྷའི་མདོ་ཉུང་ངུ་།,天經少分,天经少分,The Smaller Sūtra of the God,ལྷའི་མདོ་ཉུང་ངུ་།,lha'i mdo nyung ngu /,alpadevatāsūtra,,,,,,,,,,,,
J271,331,ཟླ་བའི་མདོ།,月經,月经,The Sūtra of the Moon,ཟླ་བའི་མདོ།,zla ba'i mdo/,candrasūtra,,,,,,,,,,,,
J272,332,ཁང་བུ་བརྩེགས་པའི་མདོ།,砌小房經,砌小房经,The Penthouse Sūtra,ཁང་བརྩེགས་མདོ།,khang brtsegs mdo/,kūṭāgārasūtra,,,,,,,,,,,,
J273,333,འཕགས་པ་གནས་འཇོག་གི་མདོ་ཞེས་བྱ།,聖安住經,圣安住经,The Sūtra of Vasiṣṭha,གནས་འཇོག་གི་མདོ།,gnas 'jog gi mdo/,[no Sanskrit title],,,,,,,,,,,,
J274,334,འཕགས་པ་དགའ་བ་ཅན་གྱི་མདོ།,聖歡喜比丘經,圣欢喜比丘经,The Sūtra of Nandika,དགའ་བ་ཅན་གྱི་མདོ།,dga' ba can gyi mdo/,nandikasūtra,,,,,,,,,,,,
J275,335,འཕགས་པ་མཁར་སིལ་གྱི་མདོ།,聖錫杖經,圣锡杖经,The Khakkhara Sūtra,འཁར་གསིལ་གྱི་མདོ།,'khar gsil gyi mdo/, Summary & variant titles,,,,,,,,,,,,
J276,336,མཁར་སིལ་འཆང་བའི་ཀུན་ཏུ་སྤྱོད་པའི་ཆོ་ག,持錫杖行法事,持锡杖行法事,The Rite of the Commitment to Bear the Mendicant's Staff,འཁར་གསིལ་འཆང་བའི་ཀུན་སྤྱོད་པའི་ཆོ་ག,'khar gsil 'chang ba'i kun spyod pa'i cho ga,[no Sanskrit title],,,,,,,,,,,,
J277,337,ཆོས་ཀྱི་འཁོར་ལོའི་མདོ།,法輪經,法轮经,The Sūtra of the Wheel of Dharma,ཆོས་འཁོར་མདོ།,chos 'khor mdo/,dharmacakrasūtra,,,,,,,,,,,,
J278,338,ལས་རྣམ་པར་འབྱེད་པ།,辨種種業,辨种种业,Classification of Acts,ལས་རྣམ་འབྱེད།,las rnam 'byed/,karmavibhaṅga,,,,,,,,,,,,
J279,339,ལས་ཀྱི་རྣམ་པར་འགྱུར་བ་ཞེས་བྱ་བ་ཆོས་ཀྱི་གཞུང་།,轉業法典,转业法典,The Dharma Scripture on the Classification of Acts,ལས་རྣམ་པར་འགྱུར་བ་ཆོས་ཀྱི་གཞུང་།,las rnam par 'gyur ba chos kyi gzhung /,karmavibhaṅgadharmagrantha,,,,,,,,,,,,
J280,340,ལས་བརྒྱ་ཐམ་པ། ༼ཧ༽,百業經（一）,百业经（一）,The Hundred Acts,ལས་བརྒྱ་པ།,las brgya pa/,karmaśataka,,,,,,,,,,,,
,342,ཀུན་ཏུ་རྒྱུ་པ་སེན་རིངས་ཀྱིས་ཞུས་པ་ཞེས་བྱ་བའི་མདོ,梵志長爪所問經,梵志长爪所问经,The Sūtra of the Wise and Foolish,མཛངས་བླུན་གྱི་མདོ།,mdzangs blun gyi mdo/,(damamūka),,,,,,,,,,,,
J281a,341,མཛངས་བླུན་ཞེས་བྱ་བའི་མདོ།,賢愚經,贤愚经,The Sūtra of the Questions of the Long-Nailed Mendicant,ཀུན་ཏུ་རྒྱུ་བ་སེན་རིངས་ཀྱིས་ཞུས་པའི་མདོ།,kun tu rgyu ba sen rings kyis zhus pa'i mdo/,dīrghanakhaparivrājaka­paripṛcchāsūtra,,,,,,,,,,,,
J282,343,གང་པོ་ལ་སོགས་པའི་རྟོགས་པ་བརྗོད་པ་བརྒྱ་པ།,集富樓那等百喻經,集富楼那等百喻经,"The Hundred Accounts of Noble Deeds,  Beginning with That of Pūrṇa",གང་པོ་ལ་སོགས་པའི་རྟོགས་པ་བརྗོད་པ་བརྒྱ་པ།,gang po la sogs pa'i rtogs pa brjod pa brgya pa/,pūrṇapramukhāvadānaśataka,,,,,,,,,,,,
J283,344,འཕགས་པ་སངས་རྒྱས་ཀྱི་རྟོགས་པ་བརྗོད་པ་ཤེས་ལྡན་གྱི་མདོ།,諸佛譬喻具慧經,诸佛譬喻具慧经,"The Sūtra of the Wise,  the Account of the Noble Deeds of the Buddha",སངས་རྒྱས་ཀྱི་རྟོགས་པ་བརྗོད་པ་ཤེས་ལྡན་གྱི་མདོ།,sangs rgyas kyi rtogs pa brjod pa shes ldan gyi mdo/,jñānakasūtrabuddhāvadāna,,,,,,,,,,,,
J284,345,ཕག་མོའི་རྟོགས་པ་བརྗོད་པ་ཞེས་བྱ་བའི་མདོ།,母豬譬喻分經,母猪譬喻分经,The Account of Noble Deeds Concerning a Sow,ཕག་མོའི་རྟོགས་པ་བརྗོད་པ།,phag mo'i rtogs pa brjod pa/,sūkarikāvadāna,,,,,,,,,,,,
J285,346,མ་ག་དྷཱ་བཟང་མོའི་རྟོགས་པ་བརྗོད་པ།,摩伽陀賢女譬喻分,摩伽陀贤女譬喻分,The Account of the Noble Deeds of Sumāgadhā,མ་ག་དྷཱ་བཟང་མོའི་རྟོགས་པ་བརྗོད་པ།,ma ga d+hA bzang mo'i rtogs pa brjod pa/,sumāgadhāvadāna,,,,,,,,,,,,
J286,347,བསོད་ནམས་ཀྱི་སྟོབས་ཀྱི་རྟོགས་པ་བརྗོད་པ།,福德力譬喻分,福德力譬喻分,The Account of the Noble Deeds of Puṇyabala,བསོད་ནམས་ཀྱི་སྟོབས་ཀྱི་རྟོགས་པ་བརྗོད་པ།,bsod nams kyi stobs kyi rtogs pa brjod pa/,puṇyabalāvadāna,,,,,,,,,,,,
J287,348,ཟླ་འོད་ཀྱི་རྟོགས་པ་བརྗོད་པ།,月光譬喻分,月光譬喻分,The Account of the Noble Deeds of Candraprabha,ཟླ་འོད་ཀྱི་རྟོགས་པ་བརྗོད་པ།,zla 'od kyi rtogs pa brjod pa/,candraprabhāvadāna,,,,,,,,,,,,
J288,349,དཔལ་གྱི་སྡེའི་རྟོགས་པ་བརྗོད་པ།,吉祥軍譬喻分,吉祥军譬喻分,The Account of the Noble Deeds of Śrīsena,དཔལ་གྱི་སྡེའི་རྟོགས་པ་བརྗོད་པ།,dpal gyi sde'i rtogs pa brjod pa/,śrīsenāvadāna,,,,,,,,,,,,
J289,350,གསེར་མདོག་གི་སྔོན་གྱི་སྦྱོར་བ་ཞེས་བྱ་བ།,金光本事分,金光本事分,The History of Kanakavarṇa,གསེར་མདོག་གི་སྔོན་གྱི་སྦྱོར་བ།,gser mdog gi sngon gyi sbyor ba/,kanakavarṇapūrvayoga,,,,,,,,,,,,
J290,351,འཕགས་པ་རྒྱལ་བུ་དོན་གྲུབ་ཀྱི་མདོ།,聖悉達多王子經,圣悉达多王子经,The Sūtra of Prince Arthasiddhi,རྒྱལ་བུ་དོན་གྲུབ་ཀྱི་མདོ།,rgyal bu don grub kyi mdo/,jinaputrārthasiddhisūtra,,,,,,,,,,,,
J291,352,ཚངས་པའི་དྲ་བའི་མདོ།,梵網經,梵网经,The Sūtra of Brahmā’s Net,ཚངས་པའི་དྲ་བའི་མདོ།,tshangs pa'i dra ba'i mdo/,brahmajālasūtra,,,,,,,,,,,,
J292,353,ཐབས་མཁས་པ་ཆེན་པོ་སངས་རྒྱས་དྲིན་ལན་བསབ་པའི་མདོ།,大方便佛報恩經,大方便佛报恩经,The Sūtra of Repaying the Kindness of the Buddha Who Has Great Skill in Means,ཐབས་མཁས་པ་ཆེན་པོ་སངས་རྒྱས་དྲིན་ལན་བསབ་པའི་མདོ།,thabs mkhas pa chen po sangs rgyas drin lan bsab pa'i mdo/, Summary & variant titles,,,,,,,,,,,,
